{
  "$schema": "./protected-operations.schema.json",
  "schemaVersion": 1,
  "catalogId": "cheatengine-sdk-lua-protected-operations",
  "host": {
    "product": "Cheat Engine",
    "version": "7.7.0.10621",
    "architecture": "x64",
    "lua": {
      "majorMinor": "5.3",
      "fixtureSha256": "C95DCDFA0F60F97B43D970D77FD1BB907AF4DE04B500A3C89A99600B20B35BD2"
    },
    "evidence": [
      {
        "component": "Lua fixture",
        "symbol": "lua53-64.dll",
        "status": "ExactInstalledFile",
        "source": "https://www.lua.org/manual/5.3/manual.html",
        "verifiedOn": "2026-09-20",
        "verification": "The SDK fixture hash matches the CE 7.7 installed Lua DLL; its hash is recorded above.",
        "note": "The fixture identity does not, by itself, prove every CE host behavior."
      }
    ]
  },
  "bridgeContract": {
    "abiMajor": 1,
    "minimumAbiMinor": 1,
    "operationBitmapWidth": 64,
    "operationBitmap": "0x00000000000007FF"
  },
  "classificationPreconditions": [
    "The Lua state, stack indices, argument types, and target tables satisfy the documented Lua 5.3 C API preconditions.",
    "The managed caller holds the SDK lifetime/serialization lease for the current attach epoch and Lua state generation.",
    "A raw operation marked never is not permission to bypass stack admission, ownership, or the protected boundary of a surrounding operation."
  ],
  "operations": [
    {
      "id": "PushBytes",
      "nativeEnum": "OP_PUSH_BYTES",
      "managed": { "constant": "PushBytesOperation", "wrapper": "PushBytes" },
      "opcode": 0,
      "capability": "push-bytes",
      "protected": true,
      "requiresNativeProtection": true,
      "raises": "memory",
      "stack": {
        "scope": "Relative to the stack before the bridge pushes its light C closure; inputs are lua_pcallk arguments.",
        "inputCount": 0,
        "inputDescription": "The bytes are borrowed from the managed call for its duration.",
        "success": { "resultCount": 1, "delta": "+1", "note": "The copied Lua string is returned by the protected call." },
        "failure": { "resultCount": 1, "delta": "+1", "note": "lua_pcallk leaves its error object." }
      },
      "ownership": {
        "input": "Managed bytes are borrowed only while the call is active.",
        "result": "Lua owns the copied string and its garbage collector determines its lifetime."
      },
      "hostOperation": "lua_pushlstring",
      "provenance": [
        {
          "component": "Lua 5.3 C API",
          "symbol": "lua_pushlstring",
          "status": "PinnedUpstream",
          "source": "https://www.lua.org/manual/5.3/manual.html#lua_pushlstring",
          "verifiedOn": "2026-09-20",
          "verification": "The manual annotation is [-0,+1,m]; m means a memory error may be raised."
        }
      ]
    },
    {
      "id": "CreateTable",
      "nativeEnum": "OP_CREATE_TABLE",
      "managed": { "constant": "CreateTableOperation", "wrapper": "CreateTable" },
      "opcode": 1,
      "capability": "create-table",
      "protected": true,
      "requiresNativeProtection": true,
      "raises": "memory",
      "stack": {
        "scope": "Relative to the stack before the bridge pushes its light C closure; inputs are lua_pcallk arguments.",
        "inputCount": 0,
        "inputDescription": "Array and record capacities travel as integer bridge parameters, not Lua stack values.",
        "success": { "resultCount": 1, "delta": "+1" },
        "failure": { "resultCount": 1, "delta": "+1", "note": "lua_pcallk leaves its error object." }
      },
      "ownership": {
        "input": "No managed or Lua input has ownership transferred.",
        "result": "Lua owns the new table."
      },
      "hostOperation": "lua_createtable",
      "provenance": [
        {
          "component": "Lua 5.3 C API",
          "symbol": "lua_createtable",
          "status": "PinnedUpstream",
          "source": "https://www.lua.org/manual/5.3/manual.html#lua_createtable",
          "verifiedOn": "2026-09-20",
          "verification": "The manual annotation is [-0,+1,m]."
        }
      ]
    },
    {
      "id": "NewUserdata",
      "nativeEnum": "OP_NEW_USERDATA",
      "managed": { "constant": "NewUserdataOperation", "wrapper": "NewUserdata" },
      "opcode": 2,
      "capability": "new-userdata",
      "protected": true,
      "requiresNativeProtection": true,
      "raises": "memory",
      "stack": {
        "scope": "Relative to the stack before the bridge pushes its light C closure; inputs are lua_pcallk arguments.",
        "inputCount": 0,
        "inputDescription": "The requested byte size travels as a bridge parameter.",
        "success": { "resultCount": 1, "delta": "+1" },
        "failure": { "resultCount": 1, "delta": "+1", "note": "lua_pcallk leaves its error object." }
      },
      "ownership": {
        "input": "No input ownership is transferred.",
        "result": "Lua owns the full-userdata allocation; later metatable and __gc behavior is separate from this allocation."
      },
      "hostOperation": "lua_newuserdata",
      "provenance": [
        {
          "component": "Lua 5.3 C API",
          "symbol": "lua_newuserdata",
          "status": "PinnedUpstream",
          "source": "https://www.lua.org/manual/5.3/manual.html#lua_newuserdata",
          "verifiedOn": "2026-09-20",
          "verification": "The manual annotation is [-0,+1,m]."
        }
      ]
    },
    {
      "id": "PushClosure",
      "nativeEnum": "OP_PUSH_CLOSURE",
      "managed": { "constant": "PushClosureOperation", "wrapper": "PushClosure" },
      "opcode": 3,
      "capability": "push-closure",
      "protected": true,
      "requiresNativeProtection": true,
      "raises": "memory",
      "conditionalFastPath": "A separately designed direct fast path may call lua_pushcclosure only when upvalueCount == 0 and lua_checkstack(state, 1) succeeded immediately before on the same call path. The current generic operation accepts arbitrary upvalues and remains protected.",
      "stack": {
        "scope": "Relative to the stack before the bridge pushes its light C closure; inputs are lua_pcallk arguments.",
        "inputCount": "upvalueCount",
        "inputDescription": "The top upvalueCount values become closure upvalues; the C-function address is borrowed.",
        "success": { "resultCount": 1, "delta": "1 - upvalueCount" },
        "failure": { "resultCount": 1, "delta": "1 - upvalueCount", "note": "lua_pcallk leaves its error object." }
      },
      "ownership": {
        "input": "Lua consumes the upvalue stack values; the managed layer must root the native callback target for as long as Lua can invoke it.",
        "result": "Lua owns the closure and its upvalue references."
      },
      "hostOperation": "lua_pushcclosure",
      "provenance": [
        {
          "component": "Lua 5.3 C API",
          "symbol": "lua_pushcclosure",
          "status": "PinnedUpstream",
          "source": "https://www.lua.org/manual/5.3/manual.html#lua_pushcclosure",
          "verifiedOn": "2026-09-20",
          "verification": "The general manual annotation is [-n,+1,m]; the Lua 5.3.6 source has a distinct n == 0 light-C-function fast path."
        }
      ]
    },
    {
      "id": "RawSet",
      "nativeEnum": "OP_RAWSET",
      "managed": { "constant": "RawSetOperation", "wrapper": "RawSet" },
      "opcode": 4,
      "capability": "raw-set",
      "protected": true,
      "requiresNativeProtection": true,
      "raises": "memory",
      "stack": {
        "scope": "Relative to the stack before the bridge pushes its light C closure; inputs are lua_pcallk arguments.",
        "inputCount": 3,
        "inputDescription": "Argument one is a copied target table, followed by key and value.",
        "success": { "resultCount": 0, "delta": "-3" },
        "failure": { "resultCount": 1, "delta": "-2", "note": "lua_pcallk consumes the arguments and leaves its error object." }
      },
      "ownership": {
        "input": "The table receives a Lua reference to the key/value as specified by Lua.",
        "result": "No result is returned."
      },
      "hostOperation": "lua_rawset",
      "provenance": [
        {
          "component": "Lua 5.3 C API",
          "symbol": "lua_rawset",
          "status": "PinnedUpstream",
          "source": "https://www.lua.org/manual/5.3/manual.html#lua_rawset",
          "verifiedOn": "2026-09-20",
          "verification": "The manual annotation is [-2,+0,m]; raw access disables metamethods but not allocation failure."
        }
      ]
    },
    {
      "id": "RawSetIndex",
      "nativeEnum": "OP_RAWSETI",
      "managed": { "constant": "RawSetIndexOperation", "wrapper": "RawSetI" },
      "opcode": 5,
      "capability": "raw-set-index",
      "protected": true,
      "requiresNativeProtection": true,
      "raises": "memory",
      "stack": {
        "scope": "Relative to the stack before the bridge pushes its light C closure; inputs are lua_pcallk arguments.",
        "inputCount": 2,
        "inputDescription": "Argument one is a copied target table and argument two is the value; the integer key is a bridge parameter.",
        "success": { "resultCount": 0, "delta": "-2" },
        "failure": { "resultCount": 1, "delta": "-1", "note": "lua_pcallk consumes the arguments and leaves its error object." }
      },
      "ownership": {
        "input": "The table receives a Lua reference to the value.",
        "result": "No result is returned."
      },
      "hostOperation": "lua_rawseti",
      "provenance": [
        {
          "component": "Lua 5.3 C API",
          "symbol": "lua_rawseti",
          "status": "PinnedUpstream",
          "source": "https://www.lua.org/manual/5.3/manual.html#lua_rawseti",
          "verifiedOn": "2026-09-20",
          "verification": "The manual annotation is [-1,+0,m]."
        }
      ]
    },
    {
      "id": "RawSetPointer",